{
  "$schema": "https://json-schema.org/draft/2020-12/schema",
  "$id": "https://vibedeck-schema.alanreisanjo.workers.dev/v1/rule-topic.schema.json",
  "title": "VibeDeck rule topic",
  "description": "Behaviors a topic must have; agents verify them before calling a task done. Lives at <repo>/.vibedeck/rules/<slug>.json.",
  "type": "object",
  "required": [
    "id",
    "title",
    "rules",
    "createdAt"
  ],
  "properties": {
    "$schema": {
      "type": "string"
    },
    "id": {
      "type": "string",
      "format": "uuid"
    },
    "title": {
      "type": "string",
      "minLength": 1
    },
    "description": {
      "type": "string"
    },
    "tags": {
      "type": "array",
      "items": {
        "type": "string"
      }
    },
    "paths": {
      "type": "array",
      "items": {
        "type": "string"
      },
      "description": "Globs relative to the project root (*, ?, **). Empty or absent: the topic applies to every task."
    },
    "rules": {
      "type": "array",
      "items": {
        "$ref": "#/$defs/rule"
      }
    },
    "sourceIdea": {
      "type": "string",
      "format": "uuid",
      "description": "Idea this topic was promoted from."
    },
    "sourcePattern": {
      "type": "string",
      "description": "Id of the project pattern (vibedeck.json `patterns`) this topic enforces."
    },
    "createdAt": {
      "type": "string",
      "format": "date-time"
    },
    "author": {
      "type": "string",
      "enum": [
        "human",
        "ai"
      ]
    }
  },
  "additionalProperties": false,
  "$defs": {
    "rule": {
      "type": "object",
      "required": [
        "id",
        "text",
        "severity",
        "author",
        "createdAt"
      ],
      "properties": {
        "id": {
          "type": "string",
          "format": "uuid"
        },
        "text": {
          "type": "string",
          "minLength": 1,
          "description": "The expected behavior, short and verifiable."
        },
        "details": {
          "type": "string",
          "description": "How to verify it."
        },
        "group": {
          "type": "string",
          "description": "Optional nested organizational group within this topic; rule IDs and checks are unchanged."
        },
        "severity": {
          "enum": [
            "must",
            "should"
          ],
          "description": "must blocks completion; should only warns."
        },
        "author": {
          "enum": [
            "human",
            "ai"
          ]
        },
        "createdAt": {
          "type": "string",
          "format": "date-time"
        },
        "test": {
          "$ref": "#/$defs/test"
        }
      },
      "additionalProperties": false
    },
    "test": {
      "type": "object",
      "description": "How the rule is verified. script: `command` runs at the project root with $VIBEDECK_FILES (exit 0 = pass, 77 = n/a, else fail) and decides the rule in checks; manual: the agent answers it. Stale when ruleHash differs from the rule's current text+details hash.",
      "required": [
        "mode",
        "ruleHash",
        "generatedAt"
      ],
      "properties": {
        "mode": {
          "enum": [
            "script",
            "manual"
          ]
        },
        "command": {
          "type": "string",
          "minLength": 1,
          "description": "Shell command (required for script), e.g. .vibedeck/tests/<topic>/<rule>.sh"
        },
        "reason": {
          "type": "string",
          "description": "What the script checks, or why the rule is manual."
        },
        "ruleHash": {
          "type": "string",
          "description": "First 16 hex chars of SHA-256(text + \"\\n\" + details) when the test was written."
        },
        "generatedAt": {
          "type": "string",
          "format": "date-time"
        }
      },
      "if": {
        "properties": {
          "mode": {
            "const": "script"
          }
        }
      },
      "then": {
        "required": [
          "command"
        ]
      },
      "additionalProperties": false
    }
  }
}
