{
  "$schema" : "https://vibedeck-schema.alanreisanjo.workers.dev/v1/rule-topic.schema.json",
  "createdAt" : "2026-10-08T03:15:16Z",
  "description" : "Interface de linha de comando e servidor MCP usados por humanos e agentes.",
  "id" : "1CACB7ED-D37D-4E72-A574-4751F0D7761D",
  "paths" : [
    "crates/vibedeck/**"
  ],
  "rules" : [
    {
      "author" : "ai",
      "createdAt" : "2026-10-08T03:15:16Z",
      "details" : "Hoje os dois cobrem as mesmas operações (status/projeto, links, docs, revisões, regras, checks, ideias, tags). Funcionalidade nova no Store do vibedeck-core que agentes ou humanos precisem ganha subcomando em crates/vibedeck/src/cli e Tool em crates/vibedeck/src/mcp/tools, com a mesma semântica.\nVerificar: o diff tem as duas pontas, ou a nota do check justifica a falta de uma.",
      "id" : "C604B203-A022-48C7-92DA-F343DA4AE60B",
      "severity" : "must",
      "test" : {
        "generatedAt" : "2026-10-22T18:52:14Z",
        "mode" : "manual",
        "reason" : "Exige julgamento: decidir se uma função nova do ProjectStore precisa de CLI e MCP, ou se a nota do check justifica faltar uma ponta.",
        "ruleHash" : "2af11e8c5bdce0b6"
      },
      "text" : "Operação nova no Core aparece no CLI e no MCP"
    },
    {
      "author" : "ai",
      "createdAt" : "2026-10-08T03:15:16Z",
      "details" : "add_review_item, add_rule, add_idea, add_idea_rule e submit_rule_check gravam Author::Ai; no CLI, só com a flag --ai. Ferramenta MCP nova que cria registro segue o mesmo padrão e diz \"author=ai\" na descrição. Só no modo `mcp --app` (do app) a ferramenta aceita author=\"human\" explícito; sem --app a autoria é sempre ai (ToolCtx::author).\nVerificar: chamadas novas de criação (add_*, import_*) no MCP passam Author::Ai.",
      "id" : "643AA948-85C0-485E-A110-E83B59C0B5BC",
      "severity" : "must",
      "test" : {
        "command" : ".vibedeck/tests/cli-e-mcp/643aa948.sh",
        "generatedAt" : "2026-10-22T18:57:54Z",
        "mode" : "script",
        "ruleHash" : "c8bc007cfcef3a8b"
      },
      "text" : "O que o MCP ou o CLI com --ai criam é author=ai"
    },
    {
      "author" : "ai",
      "createdAt" : "2026-10-08T03:15:16Z",
      "details" : "update_review_item com status=done e `vibedeck review set --status done` passam por reviews::apply_update, que chama gate::ensure_verified antes de salvar. --force (pular a verificação) existe só no CLI, para humanos, e não pode ir para o MCP (que fixa force: false).\nVerificar: caminhos novos que mudam status para done também chamam ensure_verified (via apply_update).",
      "id" : "30A2FC1A-16E7-4708-A559-0CA78431EDD7",
      "severity" : "must",
      "test" : {
        "command" : ".vibedeck/tests/cli-e-mcp/30a2fc1a.sh",
        "generatedAt" : "2026-10-22T18:52:14Z",
        "mode" : "script",
        "ruleHash" : "a554b4f8903dd085"
      },
      "text" : "Marcar done passa por ensure_verified"
    },
    {
      "author" : "ai",
      "createdAt" : "2026-10-08T03:15:16Z",
      "details" : "As instructions do servidor (REGRA OBRIGATÓRIA: rules_for -> submit_rule_check (scripts) -> corrigir até passed=true; manuais só com verify_manual=true) e as descrições de rules_for (\"OBRIGATÓRIO antes de concluir...\") e submit_rule_check (\"Com verify_manual=true, responda TODAS as manuais...\") não podem ser enfraquecidas nem removidas.\nVerificar: o texto continua em crates/vibedeck/src/mcp (instructions.rs e tools/rules.rs).",
      "id" : "A34C030C-D9E7-4C1A-A8E1-23E47D9B15AF",
      "severity" : "must",
      "test" : {
        "command" : ".vibedeck/tests/cli-e-mcp/a34c030c.sh",
        "generatedAt" : "2026-10-22T18:52:14Z",
        "mode" : "script",
        "ruleHash" : "252dd1e4ba2aa6fe"
      },
      "text" : "O MCP mantém o fluxo obrigatório de regras"
    },
    {
      "author" : "ai",
      "createdAt" : "2026-10-08T03:15:16Z",
      "details" : "A descrição da ferramenta diz \"Só faça isso quando o usuário pedir.\" Ideias são planos futuros; promover cria regras que bloqueiam tarefas.\nVerificar: a frase continua na descrição e nenhum fluxo automático promove ideias.",
      "id" : "7A76B622-C234-4B41-9ECA-C8C414AB47FE",
      "severity" : "must",
      "test" : {
        "command" : ".vibedeck/tests/cli-e-mcp/7a76b622.sh",
        "generatedAt" : "2026-10-22T18:52:14Z",
        "mode" : "script",
        "ruleHash" : "a86c4c62a1649fe2"
      },
      "text" : "promote_idea só quando o usuário pedir"
    },
    {
      "author" : "ai",
      "createdAt" : "2026-10-08T03:15:16Z",
      "details" : "O helper Args::list (crates/vibedeck/src/mcp/args.rs) aceita array JSON, string com JSON (\"[\\\"a\\\",\\\"b\\\"]\") ou texto separado por vírgulas (\"a, b\"), porque clientes MCP mandam de jeitos diferentes. Parâmetro novo de lista usa esse helper e type \"array\" no schema.\nVerificar: nenhum parse de lista feito à mão.",
      "id" : "ED4D47D8-F744-4E94-A8EE-807E2AFF0670",
      "severity" : "must",
      "test" : {
        "command" : ".vibedeck/tests/cli-e-mcp/ed4d47d8.sh",
        "generatedAt" : "2026-10-22T18:52:14Z",
        "mode" : "script",
        "ruleHash" : "e8a8992eed47f912"
      },
      "text" : "Arrays de string do MCP aceitam três formatos"
    },
    {
      "author" : "ai",
      "createdAt" : "2026-10-08T03:15:16Z",
      "details" : ".mcp.json é versionado, então o comando registrado deve ser o do PATH (symlink estável entre builds, ex.: ~/.local/bin/vibedeck) e só cai no binário atual se não houver um no PATH. Nunca gravar um caminho absoluto desta máquina no escopo project.\nVerificar: a lógica de resolução do executável (usage::vibedeck_executable_path e mcp_install::install) continua igual.",
      "id" : "05F179F3-EB5F-474B-B8C1-9E4E0926B388",
      "severity" : "must",
      "test" : {
        "command" : ".vibedeck/tests/cli-e-mcp/05f179f3.sh",
        "generatedAt" : "2026-10-22T18:52:14Z",
        "mode" : "script",
        "ruleHash" : "76bca5b94098f4c5"
      },
      "text" : "mcp install registra o vibedeck do PATH"
    },
    {
      "author" : "ai",
      "createdAt" : "2026-10-08T03:15:16Z",
      "details" : "Agentes dependem de `review list --json`, `rules for --json`, etc. A saída JSON usa vibedeck_core::json::encode (estável, chaves ordenadas). Comando novo de leitura ganha --json.\nVerificar: rodar o comando com --json e conferir que é JSON válido.",
      "id" : "21E4D353-1916-4961-B355-EC7B8DEEB0B4",
      "severity" : "must",
      "test" : {
        "generatedAt" : "2026-10-22T18:52:14Z",
        "mode" : "manual",
        "reason" : "Exige compilar e executar os comandos com --json num projeto; não é verificável por inspeção estática rápida e determinística.",
        "ruleHash" : "9c098b8a48737a50"
      },
      "text" : "Comandos de listagem e consulta mantêm --json"
    },
    {
      "author" : "ai",
      "createdAt" : "2026-10-08T03:15:16Z",
      "details" : "scripts/build-app.sh lê a versão de `version = \"...\"` em [workspace.package] do Cargo.toml raiz para o Info.plist e o nome VibeDeck-<versão>.dmg; os crates herdam com version.workspace = true. Não duplicar a versão em outro lugar; manter o formato `version = \"x.y.z\"` em uma linha.\nVerificar: o grep do script ainda encontra a versão.",
      "id" : "4913B3AF-4F67-4717-A7D4-9600D8BF0942",
      "severity" : "should",
      "test" : {
        "command" : ".vibedeck/tests/cli-e-mcp/4913b3af.sh",
        "generatedAt" : "2026-10-22T18:52:14Z",
        "mode" : "script",
        "ruleHash" : "48747f593e356ccc"
      },
      "text" : "A version do Cargo.toml (workspace) é a fonte da versão"
    },
    {
      "author" : "ai",
      "createdAt" : "2026-10-08T03:24:39Z",
      "details" : "`vibedeck ideas unpromote <ideia>` e a ferramenta MCP unpromote_idea chamam store.unpromote_idea. A descrição do MCP diz \"Só faça isso quando o usuário pedir.\", como em promote_idea.\nVerificar: os dois existem e a frase está na descrição.",
      "id" : "D94F39E0-F874-43A0-86DC-21D9FEDEC02D",
      "severity" : "must",
      "test" : {
        "command" : ".vibedeck/tests/cli-e-mcp/d94f39e0.sh",
        "generatedAt" : "2026-10-22T18:52:14Z",
        "mode" : "script",
        "ruleHash" : "c50995a1d50b2d08"
      },
      "text" : "ideas unpromote e unpromote_idea existem e só rodam a pedido do usuário"
    }
  ],
  "tags" : [
    "cli",
    "mcp"
  ],
  "title" : "CLI e MCP"
}
