{
  "$schema" : "https://vibedeck-schema.alanreisanjo.workers.dev/v1/rule-topic.schema.json",
  "createdAt" : "2026-10-09T19:10:02Z",
  "description" : "Regras vindas da ideia \"Melhorar o MD Viewer\".",
  "id" : "EB3E09D0-D052-4F2B-9001-153530242FA2",
  "paths" : [
    "Sources/VibeDeckApp/MarkdownEditor.swift",
    "Sources/VibeDeckApp/MarkdownPreview.swift",
    "Sources/VibeDeckApp/DocView.swift",
    "Sources/VibeDeckApp/IdeaView.swift"
  ],
  "rules" : [
    {
      "author" : "human",
      "createdAt" : "2026-10-08T03:16:45Z",
      "details" : "O mesmo textarea que é escrito o markdown, é o mesmo textarea que é renderizado o markdown",
      "id" : "0DD08791-BEDE-416F-9AD4-766540952496",
      "severity" : "must",
      "test" : {
        "command" : ".vibedeck/tests/melhorar-o-md-viewer/0dd08791.sh",
        "generatedAt" : "2026-10-22T19:18:51Z",
        "mode" : "script",
        "ruleHash" : "e51e1394d8423334"
      },
      "text" : "Semelhança com o Typora"
    },
    {
      "author" : "ai",
      "createdAt" : "2026-10-09T19:09:02Z",
      "details" : "Em DocView e IdeaView, o modo padrão não monta MarkdownPreview ao lado do MarkdownEditor; só existe uma view de texto editável.",
      "id" : "6B1849E4-6A0C-4140-9706-54E6EB95A61A",
      "severity" : "must",
      "test" : {
        "command" : ".vibedeck/tests/melhorar-o-md-viewer/6b1849e4.sh",
        "generatedAt" : "2026-10-22T19:18:51Z",
        "mode" : "script",
        "ruleHash" : "07628a5316dc66c7"
      },
      "text" : "O modo de edição WYSIWYG usa um único NSTextView para escrever e para exibir o markdown renderizado, sem painel de preview separado."
    },
    {
      "author" : "ai",
      "createdAt" : "2026-10-09T19:09:02Z",
      "details" : "Teste: digitar '**a**' e '# t' e conferir que textView.string e o binding são idênticos ao digitado; salvar não altera o arquivo.",
      "id" : "F8FDC0F6-4F90-40AF-9A18-2FA6139565A3",
      "severity" : "must",
      "test" : {
        "command" : ".vibedeck/tests/melhorar-o-md-viewer/f8fdc0f6.sh",
        "generatedAt" : "2026-10-22T19:18:51Z",
        "mode" : "script",
        "ruleHash" : "cc53da65121b3836"
      },
      "text" : "O texto digitado no editor continua sendo markdown puro: a renderização muda só atributos de exibição e o binding text recebe exatamente os caracteres markdown, sem perda nem reescrita."
    },
    {
      "author" : "ai",
      "createdAt" : "2026-10-09T19:09:02Z",
      "details" : "Verificar movendo o cursor: a linha com o cursor mostra os marcadores; as demais mostram só o texto formatado, como no Typora.",
      "id" : "501B105D-5D4B-4BE3-A68B-06A64DCBEAFA",
      "severity" : "must",
      "test" : {
        "command" : ".vibedeck/tests/melhorar-o-md-viewer/501b105d.sh",
        "generatedAt" : "2026-10-22T19:18:51Z",
        "mode" : "script",
        "ruleHash" : "1dd3c79db78047a8"
      },
      "text" : "A sintaxe markdown (#, **, `, [](), marcadores) fica oculta ou esmaecida nas linhas fora do cursor e visível na linha/bloco em que o cursor está."
    },
    {
      "author" : "ai",
      "createdAt" : "2026-10-09T19:09:02Z",
      "details" : "Nenhum .background com cor fixa nem tema com backgroundColor distinto em DocView, IdeaView, MarkdownEditor e MarkdownPreview; comparar visualmente em modo claro e escuro.",
      "id" : "DB31B66D-C3D7-41D0-B755-B66665E8F441",
      "severity" : "must",
      "test" : {
        "command" : ".vibedeck/tests/melhorar-o-md-viewer/db31b66d.sh",
        "generatedAt" : "2026-10-22T19:18:51Z",
        "mode" : "script",
        "ruleHash" : "2901646c503e1f02"
      },
      "text" : "O fundo do editor/visualizador de markdown usa a mesma cor de fundo da janela, sem cor de fundo própria diferente."
    },
    {
      "author" : "ai",
      "createdAt" : "2026-10-09T19:09:02Z",
      "details" : "Substituir ou ajustar .markdownTheme(.gitHub) para remover o background (ex.: .markdownTextStyle/.markdownBlockStyle sem BackgroundColor) e conferir em DocGenerate.swift:104 também.",
      "id" : "BF5BA615-1D1B-4DB7-B210-BA07AB133792",
      "severity" : "should",
      "test" : {
        "command" : ".vibedeck/tests/melhorar-o-md-viewer/bf5ba615.sh",
        "generatedAt" : "2026-10-22T19:18:51Z",
        "mode" : "script",
        "ruleHash" : "70a48479582597b7"
      },
      "text" : "Se o MarkdownPreview continuar existindo (leitura/DocGenerate), seu tema não define fundo próprio e herda o fundo do contexto."
    },
    {
      "author" : "ai",
      "createdAt" : "2026-10-09T19:09:02Z",
      "details" : "Testar: digitar, desfazer; soltar um arquivo; clicar em Anexar; mudança externa do arquivo vira edição desfazível ('Alteração externa').",
      "id" : "ADA320A2-579B-409E-8B90-B1EFD90805E7",
      "severity" : "must",
      "test" : {
        "command" : ".vibedeck/tests/melhorar-o-md-viewer/ada320a2.sh",
        "generatedAt" : "2026-10-22T19:18:51Z",
        "mode" : "script",
        "ruleHash" : "90aeaf18e43e51d8"
      },
      "text" : "Undo/redo (⌘Z/⇧⌘Z), UndoManager por documento, importação de anexos por arrastar/colar e inserção pelo botão Anexar continuam funcionando no novo editor."
    },
    {
      "author" : "ai",
      "createdAt" : "2026-10-09T19:09:02Z",
      "details" : "Abrir um doc com imagem anexada e conferir que ela é exibida no lugar do texto fora do cursor.",
      "id" : "D4086F37-888E-4FAB-B1CA-B9BC8C75B01B",
      "severity" : "should",
      "test" : {
        "command" : ".vibedeck/tests/melhorar-o-md-viewer/d4086f37.sh",
        "generatedAt" : "2026-10-22T19:18:51Z",
        "mode" : "script",
        "ruleHash" : "db3685986b440b71"
      },
      "text" : "Imagens e links relativos (../attachments/…) continuam resolvendo contra docsDir/ideasDir e aparecem renderizados no editor WYSIWYG."
    },
    {
      "author" : "ai",
      "createdAt" : "2026-10-09T19:09:02Z",
      "details" : "Abrir um markdown de ~5000 linhas e digitar; sem atraso perceptível nem reaplicar regex em todo o texto a cada tecla.",
      "id" : "27AC8B98-7A40-44C9-A3F2-F3DB43A24B19",
      "severity" : "should",
      "test" : {
        "command" : ".vibedeck/tests/melhorar-o-md-viewer/27ac8b98.sh",
        "generatedAt" : "2026-10-22T19:18:51Z",
        "mode" : "script",
        "ruleHash" : "54ac98256c38f949"
      },
      "text" : "O editor renderizado não trava ao digitar em documentos grandes: a re-renderização é limitada ao trecho editado ou ocorre fora do caminho de digitação."
    },
    {
      "author" : "ai",
      "createdAt" : "2026-10-09T19:09:02Z",
      "details" : "Conferir AgentView.swift:21, CommandView.swift:22, SkillView.swift:22 após a mudança; sem regressão de foco ou undo.",
      "id" : "A1657562-8F5C-4BBE-A007-717DA3C7C4D8",
      "severity" : "should",
      "test" : {
        "command" : ".vibedeck/tests/melhorar-o-md-viewer/a1657562.sh",
        "generatedAt" : "2026-10-22T19:18:51Z",
        "mode" : "script",
        "ruleHash" : "fa6d559b037b060c"
      },
      "text" : "Os agentes, comandos e skills que usam MarkdownEditor (AgentView, CommandView, SkillView) mantêm o comportamento atual de edição e ganham o mesmo fundo da janela."
    },
    {
      "author" : "ai",
      "createdAt" : "2026-10-09T19:09:02Z",
      "details" : "swift test passa com casos novos em Tests/VibeDeckAppTests cobrindo os atributos aplicados por MarkdownHighlighter.",
      "id" : "5C7F52C8-DC84-4FFE-AF21-5167DB99F96A",
      "severity" : "should",
      "test" : {
        "command" : ".vibedeck/tests/melhorar-o-md-viewer/5c7f52c8.sh",
        "generatedAt" : "2026-10-22T19:18:51Z",
        "mode" : "script",
        "ruleHash" : "25bfd30f57bece19"
      },
      "text" : "A mudança vem com testes de unidade para a lógica de estilização do markdown (o que fica oculto/visível conforme o cursor) e o fundo."
    }
  ],
  "sourceIdea" : "7DAA596A-E122-481B-9E02-97698E92F112",
  "title" : "Melhorar o MD Viewer"
}
