{
  "$schema" : "https://vibedeck-schema.alanreisanjo.workers.dev/v1/rule-topic.schema.json",
  "author" : "human",
  "createdAt" : "2026-10-20T19:39:06Z",
  "description" : "Regras vindas da ideia \"Novo Comportamento de quando o usuário pedir para IA implementar uma ideia já aprovada, o programa deverá perguntar ao usuário se ele deseja implementar a ideia com um workflow, ou se deseja executar da forma padrão?\".",
  "id" : "936D0EAF-6C14-43BD-8039-F8264A4860C0",
  "paths" : [
    "Sources/VibeDeckApp/IdeaView.swift",
    "Sources/VibeDeckApp/RuleDiscover.swift",
    "Sources/VibeDeckApp/ClaudeSession.swift",
    "Sources/VibeDeckApp/WorkflowView.swift",
    "Sources/VibeDeckCore/Rules.swift",
    "Sources/VibeDeckApp/ProjectModel.swift",
    "Sources/VibeDeckCore/WorkflowRuns.swift",
    "Tests/VibeDeckCoreTests/RuleDiscoverTests.swift",
    "Tests/VibeDeckCoreTests/WorkflowRunsTests.swift"
  ],
  "rules" : [
    {
      "author" : "ai",
      "createdAt" : "2026-10-20T13:44:55Z",
      "details" : "Verificar os casos approved com avaliação viável atual, avaliação ausente, inviável ou com fingerprint diferente do contentFingerprint, além de status diferente de approved.",
      "id" : "3939AE62-29B3-4CE0-A52A-D07D78036C5E",
      "severity" : "must",
      "text" : "A escolha do modo de implementação só se aplica a ideias com status approved, readiness.viable=true e readiness.fingerprint igual ao contentFingerprint."
    },
    {
      "author" : "ai",
      "createdAt" : "2026-10-20T13:44:55Z",
      "details" : "Com uma ideia elegível e pelo menos um workflow no projeto, clicar em Implementar deve apresentar Workflow, Execução padrão e Cancelar antes de iniciar a implementação.",
      "id" : "975D245B-E108-4EFB-8531-0D025E5AEF52",
      "severity" : "must",
      "text" : "O botão Implementar de uma ideia elegível deve solicitar a escolha entre workflow e execução padrão antes de iniciar a implementação."
    },
    {
      "author" : "ai",
      "createdAt" : "2026-10-20T13:44:55Z",
      "details" : "No chat do app, pedir a implementação de uma ideia elegível sem indicar o modo deve apresentar a escolha antes de executar alterações ou iniciar um workflow.",
      "id" : "7C96A9C8-340D-4E7B-B77D-C0A66851A2F9",
      "severity" : "must",
      "text" : "Um pedido no chat do app para implementar uma ideia elegível, sem modo explícito, deve aguardar a escolha entre workflow e execução padrão."
    },
    {
      "author" : "ai",
      "createdAt" : "2026-10-20T13:44:55Z",
      "details" : "Verificar que chamadas diretas pelo CLI e pelo MCP continuam funcionando sem solicitar a nova escolha de modo.",
      "id" : "F6D23E52-5042-4EF3-9D22-BE6054F64CF4",
      "severity" : "must",
      "text" : "A nova pergunta de modo de implementação deve ficar restrita ao app, sem ser exigida de IAs externas pelo CLI ou MCP."
    },
    {
      "author" : "ai",
      "createdAt" : "2026-10-20T13:44:55Z",
      "details" : "Enviar no chat um pedido explícito de execução padrão e verificar que o seletor de modo não aparece.",
      "id" : "2EC0AE3E-D46B-4F39-9B48-8276DC6344EB",
      "severity" : "must",
      "text" : "Um pedido explícito de implementação pela execução padrão deve seguir esse modo sem repetir a pergunta de modo."
    },
    {
      "author" : "ai",
      "createdAt" : "2026-10-20T13:44:55Z",
      "details" : "Enviar um pedido que nomeie um workflow existente e verificar que ele é selecionado sem abrir a pergunta entre workflow e execução padrão.",
      "id" : "B931C93F-2EBE-4A59-9856-009CCCECC025",
      "severity" : "must",
      "text" : "Um pedido explícito de implementação com um workflow existente deve selecionar esse workflow sem repetir a pergunta de modo."
    },
    {
      "author" : "ai",
      "createdAt" : "2026-10-20T13:44:55Z",
      "details" : "Com workflows no projeto, escolher Workflow e verificar que o usuário pode selecionar qual deles executar.",
      "id" : "F2157EB6-6145-4ABA-87A5-FCCE8C8CDBFE",
      "severity" : "must",
      "text" : "A opção Workflow deve permitir selecionar um workflow existente no projeto."
    },
    {
      "author" : "ai",
      "createdAt" : "2026-10-20T13:44:55Z",
      "details" : "Com pelo menos um workflow no projeto, abrir a seleção e verificar o acesso ao catálogo para adicionar um workflow antes de selecioná-lo para implementação.",
      "id" : "7E0054D4-F8A3-4144-8C58-B53E1C4B5F2B",
      "severity" : "must",
      "text" : "Quando houver workflows no projeto, o seletor de workflow da implementação deve oferecer acesso à adição de workflows do catálogo."
    },
    {
      "author" : "ai",
      "createdAt" : "2026-10-20T13:44:55Z",
      "details" : "Com a lista de workflows vazia, verificar que a escolha oferece somente Execução padrão e Cancelar, sem seleção de workflow nem acesso ao catálogo nesse diálogo.",
      "id" : "AEFCDB67-BC3D-46F0-A764-7E81EC82C8B4",
      "severity" : "must",
      "text" : "Se o projeto não tiver workflows, a escolha de implementação deve oferecer apenas execução padrão e cancelar."
    },
    {
      "author" : "ai",
      "createdAt" : "2026-10-20T13:44:55Z",
      "details" : "Cancelar o seletor e verificar que não houve envio do prompt de implementação, criação ou retomada de execução, nem promoção da ideia causada por esse pedido.",
      "id" : "D008570A-BD7C-477E-85FE-2730F2307C2B",
      "severity" : "must",
      "text" : "Cancelar a escolha de implementação deve encerrar o pedido sem iniciar a implementação nem promover a ideia."
    },
    {
      "author" : "ai",
      "createdAt" : "2026-10-20T13:44:55Z",
      "details" : "Escolher Execução padrão e verificar que o chat recebe o prompt produzido por IdeaImplementation.prompt, sem criar uma execução de workflow.",
      "id" : "A3EFE728-C709-4B69-B5D3-7CE3FBE5414D",
      "severity" : "must",
      "text" : "A execução padrão deve usar o fluxo de implementação por IdeaImplementation.prompt."
    },
    {
      "author" : "ai",
      "createdAt" : "2026-10-20T13:44:55Z",
      "details" : "Escolher um workflow e verificar que sua execução recebe uma referência recuperável da ideia, permitindo ler a descrição e as regras correspondentes.",
      "id" : "7B7C27C6-AA8A-4A70-AB5C-1AE771D9AE05",
      "severity" : "must",
      "text" : "A execução por workflow deve receber a identificação da ideia que será implementada como parte de sua entrada."
    },
    {
      "author" : "ai",
      "createdAt" : "2026-10-20T13:44:55Z",
      "details" : "Iniciar o mesmo workflow para a mesma ideia após editar seu título ou descrição e verificar que a execução anterior ainda é reconhecida como pertencente àquela ideia.",
      "id" : "AA2E3BF6-2963-44E6-A6E4-169EB3829341",
      "severity" : "must",
      "text" : "A identificação de uma execução para a mesma ideia e workflow deve permanecer estável quando o título ou a descrição da ideia mudar."
    },
    {
      "author" : "ai",
      "createdAt" : "2026-10-20T13:44:55Z",
      "details" : "Criar uma execução para a ideia e o workflow selecionado e solicitar nova implementação; verificar a pergunta Retomar ou Reiniciar, inclusive quando o workflow foi indicado explicitamente no chat.",
      "id" : "624C3483-D3C4-4DDA-BF50-760262C15A86",
      "severity" : "must",
      "text" : "Quando já existir uma execução do workflow escolhido para a mesma ideia, o app deve perguntar se o usuário deseja retomar ou reiniciar antes de continuar."
    },
    {
      "author" : "ai",
      "createdAt" : "2026-10-20T13:44:55Z",
      "details" : "Pausar uma execução com progresso registrado, escolher Retomar e verificar que o histórico permanece e a execução continua do estado persistido.",
      "id" : "04EEB887-C1AC-4D76-A08A-3FC1E017BBEC",
      "severity" : "must",
      "text" : "Escolher Retomar deve continuar a execução existente a partir do estado persistido, sem reiniciar etapas já concluídas."
    },
    {
      "author" : "ai",
      "createdAt" : "2026-10-20T13:44:55Z",
      "details" : "Usar uma execução parcialmente concluída, escolher Reiniciar e verificar que a próxima etapa passa a ser a etapa inicial do workflow.",
      "id" : "7D9E4052-9E5D-41E6-AFD3-6B03D1FA810E",
      "severity" : "must",
      "text" : "Escolher Reiniciar deve começar a execução pela etapa inicial do workflow selecionado."
    },
    {
      "author" : "ai",
      "createdAt" : "2026-10-20T13:44:55Z",
      "details" : "Abrir a escolha com uma ideia elegível, alterar externamente seu conteúdo para invalidar a avaliação e confirmar; verificar que a implementação não inicia com a avaliação anterior.",
      "id" : "C7F89480-6587-425D-BD4D-D595EBD56133",
      "severity" : "must",
      "text" : "Ao confirmar o modo de implementação, o app deve revalidar a elegibilidade da ideia usando seu conteúdo atual."
    }
  ],
  "sourceIdea" : "32D7FF3C-E017-4C95-B4B9-82B357E76F4E",
  "title" : "Novo Comportamento de quando o usuário pedir para IA implementar uma ideia já aprovada, o programa deverá perguntar ao usuário se ele deseja implementar a ideia com um workflow, ou se deseja executar da forma padrão?"
}
