{
  "$schema" : "https://vibedeck-schema.alanreisanjo.workers.dev/v1/rule-topic.schema.json",
  "createdAt" : "2026-10-08T03:15:16Z",
  "description" : "Cloudflare Worker que serve os JSON Schemas e os próprios schemas v1.",
  "id" : "7521B402-8AE0-4593-A6C2-8809CC2FF6EE",
  "paths" : [
    "worker/**",
    "schema/**"
  ],
  "rules" : [
    {
      "author" : "ai",
      "createdAt" : "2026-10-08T03:15:16Z",
      "details" : "`npm run sync` apaga worker/public e copia ../schema/v1 para public/v1 (roda em dev, deploy e no CI). Edite sempre schema/v1/*.schema.json; mudanças em worker/public se perdem.\nVerificar: o diff não toca em worker/public/**.",
      "id" : "EFDEC345-F90B-41DA-9484-9F470C8E3E94",
      "severity" : "must",
      "test" : {
        "command" : ".vibedeck/tests/worker-e-schemas/efdec345.sh",
        "generatedAt" : "2026-10-09T01:24:02Z",
        "mode" : "script",
        "reason" : "Falha se VIBEDECK_FILES toca worker/public/**, se algo em worker/public é versionado, se deixa de ser ignorado ou se o script sync não regenera public a partir de ../schema/v1.",
        "ruleHash" : "5b85fd2dfba2253f"
      },
      "text" : "schema/v1 é a fonte; worker/public é gerado"
    },
    {
      "author" : "ai",
      "createdAt" : "2026-10-08T03:15:16Z",
      "details" : "No diretório worker/: `npm ci && npm run sync && npm run typecheck` (o mesmo job check de .github/workflows/worker.yml).\nVerificar: rodar e anexar o resultado na nota do check.",
      "id" : "4C804BFE-C826-440C-A3DF-F22AF3D16FD5",
      "severity" : "must",
      "test" : {
        "command" : ".vibedeck/tests/worker-e-schemas/4c804bfe.sh",
        "generatedAt" : "2026-10-09T01:24:02Z",
        "mode" : "script",
        "reason" : "Em worker/: npm ci --offline (só se node_modules diverge do package-lock), npm run sync e npm run typecheck.",
        "ruleHash" : "428dbe3f86f05d87"
      },
      "text" : "npm run typecheck passa"
    },
    {
      "author" : "ai",
      "createdAt" : "2026-10-08T03:15:16Z",
      "details" : "worker/src/index.ts: OPTIONS -> 204 com CORS; outros métodos -> 405 com CORS; asset inexistente -> 404 com CORS; asset encontrado -> headers do asset + CORS. Editores e validadores buscam os schemas de outras origens.\nVerificar: toda resposta nova inclui os headers CORS.",
      "id" : "A486BCE3-EAA0-47DD-8826-B20BF64166F5",
      "severity" : "must",
      "test" : {
        "command" : ".vibedeck/tests/worker-e-schemas/a486bce3.sh",
        "generatedAt" : "2026-10-09T01:24:02Z",
        "mode" : "script",
        "reason" : "CORS com Allow-Origin * e métodos GET, HEAD, OPTIONS; OPTIONS 204, outros 405, asset ausente 404, todos com CORS; todo new Response/Response.json em worker/src leva headers CORS.",
        "ruleHash" : "38d523f732627081"
      },
      "text" : "CORS em todas as respostas; só GET/HEAD/OPTIONS"
    },
    {
      "author" : "ai",
      "createdAt" : "2026-10-08T03:15:16Z",
      "details" : "/, /v1 e /v1/ devolvem {name, schemas:{...}} com todos os schemas de schema/v1. Schema novo entra nesse índice, nos nomes que o Core Rust passa a `schema_url(...)` (crates/vibedeck-core/src/model), no `SchemaURL` do app e na linha \"Schemas:\" do guia de referência (crates/vibedeck-core/src/ai/guide_reference.md → .vibedeck/guide.md; o AGENTS.md compacto não a repete, por economia de tokens).\nVerificar: índice do worker, `schema_url`, `SchemaURL` do app, a linha \"Schemas:\" do guide.md e os arquivos de schema/v1 listam o mesmo conjunto.",
      "id" : "CD3057F2-1C45-4F09-A9C7-7EC146998DFA",
      "severity" : "must",
      "test" : {
        "command" : ".vibedeck/tests/worker-e-schemas/cd3057f2.sh",
        "generatedAt" : "2026-10-22T18:57:24Z",
        "mode" : "script",
        "reason" : "Mesmo conjunto de schemas no índice do worker, em SchemaURL, na linha Schemas: do guide.md/AgentsGuide.swift e em schema/v1; chaves do índice iguais aos nomes do SchemaURL.",
        "ruleHash" : "dbca5c75983653ff"
      },
      "text" : "O índice lista todos os schemas"
    },
    {
      "author" : "ai",
      "createdAt" : "2026-10-08T03:15:16Z",
      "details" : "Os arquivos gravados pelo Core têm $schema = `schema_url(...)` (base `SCHEMA_BASE`, em crates/vibedeck-core/src/model/project.rs); o $id de cada schema/v1/*.schema.json deve ser a mesma URL, para os editores resolverem.\nVerificar: `grep \"\\$id\" schema/v1/*.json` usa a base de SCHEMA_BASE.",
      "id" : "0A89A5BC-A21B-465C-AE44-9099C3D77A9B",
      "severity" : "must",
      "test" : {
        "command" : ".vibedeck/tests/worker-e-schemas/0a89a5bc.sh",
        "generatedAt" : "2026-10-22T18:57:24Z",
        "mode" : "script",
        "reason" : "O $id de cada schema/*/*.schema.json é igual à URL derivada de SchemaURL.base em Models.swift.",
        "ruleHash" : "57d8cc083ff59fb4"
      },
      "text" : "O $id dos schemas bate com SCHEMA_BASE"
    },
    {
      "author" : "ai",
      "createdAt" : "2026-10-08T03:15:16Z",
      "details" : "Arquivos existentes apontam para /v1/... Tornar um campo obrigatório, renomear ou remover um campo quebra projetos já criados; nesse caso, crie schema/v2 (e suba version no Project) em vez de alterar a v1. Mudanças compatíveis (campo opcional novo) podem ir na v1.\nVerificar: diffs em schema/v1 só adicionam campos opcionais.",
      "id" : "48A5C815-B18A-4F32-B67E-E2A8F8FB216E",
      "severity" : "should",
      "test" : {
        "command" : ".vibedeck/tests/worker-e-schemas/48a5c815.sh",
        "generatedAt" : "2026-10-09T01:24:02Z",
        "mode" : "script",
        "reason" : "Compara schema/v1 com o HEAD: falha se um schema ou campo some, se surge required novo, se type/const/pattern/format mudam, se um enum perde valores, se limites min/max apertam ou se additionalProperties vira false.",
        "ruleHash" : "59bb64a7fbfde2ba"
      },
      "text" : "Mudança incompatível de schema vai para nova versão"
    }
  ],
  "tags" : [
    "worker",
    "schema"
  ],
  "title" : "Worker e schemas"
}
